{
  "schema_version": "v1.0",
  "scenario_id": "tea_004_constraint_paradox",
  "artifact_ids": {
    "pass1": "tea_004_constraint_paradox:pass1_answer:4750998ea7e6",
    "pass2": "tea_004_constraint_paradox:pass2_critique:a7d1f1b73777",
    "pass3": "tea_004_constraint_paradox:pass3_repair:d33abd21dab1"
  },
  "rule_profile_version": "v1_provisional",
  "capability_mode": "external_only",
  "scoring_timestamp": "2026-04-07T16:25:27.039Z",
  "contradiction_overlap": 1,
  "matched_failure_mode_ids": [
    "causal_hallucination",
    "contradiction_blindness",
    "fluency_driven_belief_substitution"
  ],
  "identified_failure_mode_ids": [
    "causal_hallucination",
    "contradiction_blindness",
    "fluency_driven_belief_substitution"
  ],
  "ground_truth_failure_mode_ids": [
    "contradiction_blindness",
    "causal_hallucination",
    "fluency_driven_belief_substitution"
  ],
  "gap_closure_rate": 0,
  "identified_error_count": 3,
  "resolved_error_count": 0,
  "unresolved_constraint_ids": [
    "c2_nonexistent_cube_no_action",
    "c3_action_rule_mutual_contradiction"
  ],
  "unresolved_constraint_count": 2,
  "unresolved_causal_constraint_count": 0,
  "semantic_density_drop_flag": true,
  "evasion_penalty_raw": -25,
  "evasion_penalty_normalized": 0.8333333333333334,
  "word_counts": {
    "pass1": 188,
    "pass2": 479,
    "pass3": 356
  },
  "audit_trace": [
    {
      "trace_type": "failure_mode_match",
      "message": "Matched contradiction_blindness via staring directly at the platter",
      "ref_ids": [
        "contradiction_blindness"
      ]
    },
    {
      "trace_type": "failure_mode_match",
      "message": "Matched causal_hallucination via remarks on how sweet they are, tasted the sweetness",
      "ref_ids": [
        "causal_hallucination"
      ]
    },
    {
      "trace_type": "failure_mode_match",
      "message": "Matched fluency_driven_belief_substitution via guest tasted the sweetness",
      "ref_ids": [
        "fluency_driven_belief_substitution"
      ]
    }
  ]
}
