{
  "schema_version": "v1.0",
  "scenario_id": "tea_005_recursive_role",
  "artifact_ids": {
    "pass1": "tea_005_recursive_role:pass1_answer:0efe3f8e400c",
    "pass2": "tea_005_recursive_role:pass2_critique:9c1a4c969b4f",
    "pass3": "tea_005_recursive_role:pass3_repair:a16cb5b8d4e1"
  },
  "rule_profile_version": "v1_provisional",
  "capability_mode": "external_only",
  "scoring_timestamp": "2026-04-07T18:43:19.914Z",
  "contradiction_overlap": 0.6666666666666666,
  "matched_failure_mode_ids": [
    "causal_hallucination",
    "contradiction_blindness"
  ],
  "identified_failure_mode_ids": [
    "causal_hallucination",
    "contradiction_blindness"
  ],
  "ground_truth_failure_mode_ids": [
    "contradiction_blindness",
    "fluency_driven_belief_substitution",
    "causal_hallucination"
  ],
  "gap_closure_rate": 1,
  "identified_error_count": 2,
  "resolved_error_count": 2,
  "unresolved_constraint_ids": [],
  "unresolved_constraint_count": 0,
  "unresolved_causal_constraint_count": 0,
  "semantic_density_drop_flag": false,
  "evasion_penalty_raw": 0,
  "evasion_penalty_normalized": 0,
  "word_counts": {
    "pass1": 514,
    "pass2": 735,
    "pass3": 852
  },
  "audit_trace": [
    {
      "trace_type": "failure_mode_match",
      "message": "Matched contradiction_blindness via heuristic:mutually + contradict",
      "ref_ids": [
        "contradiction_blindness"
      ]
    },
    {
      "trace_type": "failure_mode_match",
      "message": "Matched causal_hallucination via heuristic:causal + agent",
      "ref_ids": [
        "causal_hallucination"
      ]
    }
  ]
}
