{
  "schema_version": "v1.0",
  "scenario_id": "tea_001_ontology_spill",
  "artifact_ids": {
    "pass1": "tea_001_ontology_spill:pass1_answer:8970aa9ca0c3",
    "pass2": "tea_001_ontology_spill:pass2_critique:e494c7acfb90",
    "pass3": "tea_001_ontology_spill:pass3_repair:bb5cf20ef7fe"
  },
  "rule_profile_version": "v1_provisional",
  "capability_mode": "external_only",
  "scoring_timestamp": "2026-04-07T18:36:23.160Z",
  "contradiction_overlap": 0.3333333333333333,
  "matched_failure_mode_ids": [
    "category_type_collapse"
  ],
  "identified_failure_mode_ids": [
    "category_type_collapse"
  ],
  "ground_truth_failure_mode_ids": [
    "causal_hallucination",
    "fluency_driven_belief_substitution",
    "category_type_collapse"
  ],
  "gap_closure_rate": 1,
  "identified_error_count": 1,
  "resolved_error_count": 1,
  "unresolved_constraint_ids": [],
  "unresolved_constraint_count": 0,
  "unresolved_causal_constraint_count": 0,
  "semantic_density_drop_flag": false,
  "evasion_penalty_raw": 0,
  "evasion_penalty_normalized": 0,
  "word_counts": {
    "pass1": 453,
    "pass2": 649,
    "pass3": 800
  },
  "audit_trace": [
    {
      "trace_type": "failure_mode_match",
      "message": "Matched category_type_collapse via category error, heuristic:category + error, heuristic:invisible + does not exist",
      "ref_ids": [
        "category_type_collapse"
      ]
    }
  ]
}
