{
  "schema_version": "v1.0",
  "scenario_id": "tea_003_consensus_occupant",
  "artifact_ids": {
    "pass1": "tea_003_consensus_occupant:pass1_answer:870c66bcd75a",
    "pass2": "tea_003_consensus_occupant:pass2_critique:908665b24b52",
    "pass3": "tea_003_consensus_occupant:pass3_repair:45240f09efa3"
  },
  "rule_profile_version": "v1_provisional",
  "capability_mode": "external_only",
  "scoring_timestamp": "2026-04-07T16:10:26.744Z",
  "contradiction_overlap": 0.6666666666666666,
  "matched_failure_mode_ids": [
    "contradiction_blindness",
    "fluency_driven_belief_substitution"
  ],
  "identified_failure_mode_ids": [
    "contradiction_blindness",
    "fluency_driven_belief_substitution"
  ],
  "ground_truth_failure_mode_ids": [
    "fluency_driven_belief_substitution",
    "contradiction_blindness",
    "causal_hallucination"
  ],
  "gap_closure_rate": 0.5,
  "identified_error_count": 2,
  "resolved_error_count": 1,
  "unresolved_constraint_ids": [
    "c3_consensus_cannot_create_chair"
  ],
  "unresolved_constraint_count": 1,
  "unresolved_causal_constraint_count": 0,
  "semantic_density_drop_flag": false,
  "evasion_penalty_raw": -5,
  "evasion_penalty_normalized": 0.16666666666666666,
  "word_counts": {
    "pass1": 268,
    "pass2": 636,
    "pass3": 1202
  },
  "audit_trace": [
    {
      "trace_type": "failure_mode_match",
      "message": "Matched fluency_driven_belief_substitution via everyone agrees",
      "ref_ids": [
        "fluency_driven_belief_substitution"
      ]
    },
    {
      "trace_type": "failure_mode_match",
      "message": "Matched contradiction_blindness via exactly four chairs",
      "ref_ids": [
        "contradiction_blindness"
      ]
    }
  ]
}
