{
  "schema_version": "v1.0",
  "scenario_id": "tea_003_consensus_occupant",
  "artifact_ids": {
    "pass1": "tea_003_consensus_occupant:pass1_answer:1ce0cf8a91e0",
    "pass2": "tea_003_consensus_occupant:pass2_critique:63a826772dea",
    "pass3": "tea_003_consensus_occupant:pass3_repair:864e9881b209"
  },
  "rule_profile_version": "v1_provisional",
  "capability_mode": "external_only",
  "scoring_timestamp": "2026-04-07T16:00:29.983Z",
  "contradiction_overlap": 0.3333333333333333,
  "matched_failure_mode_ids": [
    "contradiction_blindness"
  ],
  "identified_failure_mode_ids": [
    "contradiction_blindness"
  ],
  "ground_truth_failure_mode_ids": [
    "fluency_driven_belief_substitution",
    "contradiction_blindness",
    "causal_hallucination"
  ],
  "gap_closure_rate": 1,
  "identified_error_count": 1,
  "resolved_error_count": 1,
  "unresolved_constraint_ids": [],
  "unresolved_constraint_count": 0,
  "unresolved_causal_constraint_count": 0,
  "semantic_density_drop_flag": false,
  "evasion_penalty_raw": 0,
  "evasion_penalty_normalized": 0,
  "word_counts": {
    "pass1": 314,
    "pass2": 763,
    "pass3": 938
  },
  "audit_trace": [
    {
      "trace_type": "failure_mode_match",
      "message": "Matched contradiction_blindness via all five are seated, exactly four chairs, heuristic:mutually + contradict",
      "ref_ids": [
        "contradiction_blindness"
      ]
    }
  ]
}
