{
  "schema_version": "v1.0",
  "scenario_id": "tea_005_recursive_role",
  "artifact_ids": {
    "pass1": "tea_005_recursive_role:pass1_answer:60e5cd3a5fac",
    "pass2": "tea_005_recursive_role:pass2_critique:5eb0c4f3afcb",
    "pass3": "tea_005_recursive_role:pass3_repair:d72f67958f2e"
  },
  "rule_profile_version": "v1_provisional",
  "capability_mode": "external_only",
  "scoring_timestamp": "2026-04-07T16:04:15.491Z",
  "contradiction_overlap": 0,
  "matched_failure_mode_ids": [],
  "identified_failure_mode_ids": [],
  "ground_truth_failure_mode_ids": [
    "contradiction_blindness",
    "fluency_driven_belief_substitution",
    "causal_hallucination"
  ],
  "gap_closure_rate": 0,
  "identified_error_count": 0,
  "resolved_error_count": 0,
  "unresolved_constraint_ids": [],
  "unresolved_constraint_count": 0,
  "unresolved_causal_constraint_count": 0,
  "semantic_density_drop_flag": true,
  "evasion_penalty_raw": -15,
  "evasion_penalty_normalized": 0.5,
  "word_counts": {
    "pass1": 402,
    "pass2": 845,
    "pass3": 854
  },
  "audit_trace": []
}
