{
  "schema_version": "v1.0",
  "scenario_id": "tea_005_recursive_role",
  "artifact_ids": {
    "pass1": "tea_005_recursive_role:pass1_answer:2b230085b140",
    "pass2": "tea_005_recursive_role:pass2_critique:9106cfedfbd8",
    "pass3": "tea_005_recursive_role:pass3_repair:747f30fea64f"
  },
  "rule_profile_version": "v1_provisional",
  "capability_mode": "external_only",
  "scoring_timestamp": "2026-04-07T16:29:15.448Z",
  "contradiction_overlap": 0.3333333333333333,
  "matched_failure_mode_ids": [
    "causal_hallucination"
  ],
  "identified_failure_mode_ids": [
    "causal_hallucination"
  ],
  "ground_truth_failure_mode_ids": [
    "contradiction_blindness",
    "fluency_driven_belief_substitution",
    "causal_hallucination"
  ],
  "gap_closure_rate": 0,
  "identified_error_count": 1,
  "resolved_error_count": 0,
  "unresolved_constraint_ids": [
    "c3_empty_room_circular_bootstrap"
  ],
  "unresolved_constraint_count": 1,
  "unresolved_causal_constraint_count": 0,
  "semantic_density_drop_flag": true,
  "evasion_penalty_raw": -20,
  "evasion_penalty_normalized": 0.6666666666666666,
  "word_counts": {
    "pass1": 356,
    "pass2": 571,
    "pass3": 531
  },
  "audit_trace": [
    {
      "trace_type": "failure_mode_match",
      "message": "Matched causal_hallucination via heuristic:asserted + cause",
      "ref_ids": [
        "causal_hallucination"
      ]
    }
  ]
}
