{
  "schema_version": "v1.0",
  "scenario_id": "tea_002_category_fairness",
  "artifact_ids": {
    "pass1": "tea_002_category_fairness:pass1_answer:3dc5a7ec4270",
    "pass2": "tea_002_category_fairness:pass2_critique:bd400942c5ba",
    "pass3": "tea_002_category_fairness:pass3_repair:d5bc16a429d2"
  },
  "rule_profile_version": "v1_provisional",
  "capability_mode": "external_only",
  "scoring_timestamp": "2026-04-07T15:58:38.016Z",
  "contradiction_overlap": 0.5,
  "matched_failure_mode_ids": [
    "category_type_collapse"
  ],
  "identified_failure_mode_ids": [
    "category_type_collapse"
  ],
  "ground_truth_failure_mode_ids": [
    "fluency_driven_belief_substitution",
    "category_type_collapse"
  ],
  "gap_closure_rate": 1,
  "identified_error_count": 1,
  "resolved_error_count": 1,
  "unresolved_constraint_ids": [],
  "unresolved_constraint_count": 0,
  "unresolved_causal_constraint_count": 0,
  "semantic_density_drop_flag": false,
  "evasion_penalty_raw": 0,
  "evasion_penalty_normalized": 0,
  "word_counts": {
    "pass1": 303,
    "pass2": 708,
    "pass3": 801
  },
  "audit_trace": [
    {
      "trace_type": "failure_mode_match",
      "message": "Matched category_type_collapse via liquid additive",
      "ref_ids": [
        "category_type_collapse"
      ]
    }
  ]
}
