{
  "schema_version": "v1.0",
  "scenario_id": "tea_006_temporal_inversion",
  "artifact_ids": {
    "pass1": "tea_006_temporal_inversion:pass1_answer:11e0abe3578b",
    "pass2": "tea_006_temporal_inversion:pass2_critique:222affa6050d",
    "pass3": "tea_006_temporal_inversion:pass3_repair:86945c49d221"
  },
  "rule_profile_version": "v1_provisional",
  "capability_mode": "external_only",
  "scoring_timestamp": "2026-04-07T16:32:06.203Z",
  "contradiction_overlap": 0.6666666666666666,
  "matched_failure_mode_ids": [
    "contradiction_blindness",
    "fluency_driven_belief_substitution"
  ],
  "identified_failure_mode_ids": [
    "contradiction_blindness",
    "fluency_driven_belief_substitution"
  ],
  "ground_truth_failure_mode_ids": [
    "causal_hallucination",
    "contradiction_blindness",
    "fluency_driven_belief_substitution"
  ],
  "gap_closure_rate": 0.5,
  "identified_error_count": 2,
  "resolved_error_count": 1,
  "unresolved_constraint_ids": [
    "c1_apology_cannot_precede_cause",
    "c3_forward_causality_only"
  ],
  "unresolved_constraint_count": 2,
  "unresolved_causal_constraint_count": 2,
  "semantic_density_drop_flag": false,
  "evasion_penalty_raw": -10,
  "evasion_penalty_normalized": 0.3333333333333333,
  "word_counts": {
    "pass1": 264,
    "pass2": 483,
    "pass3": 463
  },
  "audit_trace": [
    {
      "trace_type": "failure_mode_match",
      "message": "Matched contradiction_blindness via trousers are completely dry",
      "ref_ids": [
        "contradiction_blindness"
      ]
    },
    {
      "trace_type": "failure_mode_match",
      "message": "Matched fluency_driven_belief_substitution via sincere apology",
      "ref_ids": [
        "fluency_driven_belief_substitution"
      ]
    }
  ]
}
