{
  "schema_version": "v1.0",
  "scenario_id": "tea_003_consensus_occupant",
  "artifact_ids": {
    "pass1": "tea_003_consensus_occupant:pass1_answer:b9d8b4816729",
    "pass2": "tea_003_consensus_occupant:pass2_critique:947e76603a50",
    "pass3": "tea_003_consensus_occupant:pass3_repair:06785517ab1a"
  },
  "rule_profile_version": "v1_provisional",
  "capability_mode": "external_only",
  "scoring_timestamp": "2026-04-07T18:39:41.718Z",
  "contradiction_overlap": 1,
  "matched_failure_mode_ids": [
    "causal_hallucination",
    "contradiction_blindness",
    "fluency_driven_belief_substitution"
  ],
  "identified_failure_mode_ids": [
    "causal_hallucination",
    "contradiction_blindness",
    "fluency_driven_belief_substitution"
  ],
  "ground_truth_failure_mode_ids": [
    "fluency_driven_belief_substitution",
    "contradiction_blindness",
    "causal_hallucination"
  ],
  "gap_closure_rate": 0.3333333333333333,
  "identified_error_count": 3,
  "resolved_error_count": 1,
  "unresolved_constraint_ids": [
    "c3_consensus_cannot_create_chair"
  ],
  "unresolved_constraint_count": 1,
  "unresolved_causal_constraint_count": 0,
  "semantic_density_drop_flag": true,
  "evasion_penalty_raw": -20,
  "evasion_penalty_normalized": 0.6666666666666666,
  "word_counts": {
    "pass1": 410,
    "pass2": 567,
    "pass3": 655
  },
  "audit_trace": [
    {
      "trace_type": "failure_mode_match",
      "message": "Matched fluency_driven_belief_substitution via everyone agrees",
      "ref_ids": [
        "fluency_driven_belief_substitution"
      ]
    },
    {
      "trace_type": "failure_mode_match",
      "message": "Matched contradiction_blindness via exactly four chairs",
      "ref_ids": [
        "contradiction_blindness"
      ]
    },
    {
      "trace_type": "failure_mode_match",
      "message": "Matched causal_hallucination via heuristic:causal + origin",
      "ref_ids": [
        "causal_hallucination"
      ]
    }
  ]
}
