{
  "schema_version": "v1.0",
  "scenario_id": "tea_004_constraint_paradox",
  "artifact_ids": {
    "pass1": "tea_004_constraint_paradox:pass1_answer:9702e6d27bc1",
    "pass2": "tea_004_constraint_paradox:pass2_critique:b48f709996d2",
    "pass3": "tea_004_constraint_paradox:pass3_repair:794140bd1df4"
  },
  "rule_profile_version": "v1_provisional",
  "capability_mode": "external_only",
  "scoring_timestamp": "2026-04-07T15:51:55.626Z",
  "contradiction_overlap": 0.3333333333333333,
  "matched_failure_mode_ids": [
    "contradiction_blindness"
  ],
  "identified_failure_mode_ids": [
    "contradiction_blindness"
  ],
  "ground_truth_failure_mode_ids": [
    "contradiction_blindness",
    "causal_hallucination",
    "fluency_driven_belief_substitution"
  ],
  "gap_closure_rate": 0,
  "identified_error_count": 1,
  "resolved_error_count": 0,
  "unresolved_constraint_ids": [
    "c1_unobserved_existence_rule"
  ],
  "unresolved_constraint_count": 1,
  "unresolved_causal_constraint_count": 0,
  "semantic_density_drop_flag": true,
  "evasion_penalty_raw": -20,
  "evasion_penalty_normalized": 0.6666666666666666,
  "word_counts": {
    "pass1": 279,
    "pass2": 659,
    "pass3": 567
  },
  "audit_trace": [
    {
      "trace_type": "failure_mode_match",
      "message": "Matched contradiction_blindness via staring directly at the platter",
      "ref_ids": [
        "contradiction_blindness"
      ]
    }
  ]
}
